id,title,start_seconds,duration_seconds,end_seconds,shot_type,camera_movement,music_rhythm_point,subtitle
S01,Golden Hall Opening,0,5,5,wide establishing vertical shot,"slow dolly-in from the aisle toward the stage, stable and elegant","0:00 - first soft D major arpeggio, the hall breathes before the melody begins",The hall falls silent.
S02,First Phrase Side Profile,5,6,11,medium side profile,"slow side dolly from left to right, very controlled",0:05 - Canon ground bass settles into the rhythm; melody enters gently,Canon in D begins with a quiet pulse.
S03,Hands on Canon Pattern,11,5,16,close-up hands on keys,subtle push-in with minimal lateral motion,0:11 - melody becomes recognizable; gentle right-hand movement over stable left hand,The melody begins to flow.
S04,Over the Shoulder Reflection,16,6,22,over-the-shoulder,slow shoulder-level glide forward,0:16 - Canon progression turns inward; visual reflection matches the repeating melody,A phrase answers itself.
S05,Three-Quarter Keyboard View,22,5,27,three-quarter overhead,"very slow descending crane movement, almost still",0:22 - right hand pattern rises; the visual emphasis is clean fingering,Every note is measured and light.
S06,Portrait of Concentration,27,6,33,intimate portrait medium close-up,slow push-in toward the pianist's side profile,0:27 - emotional lift in the melody; let the face carry the feeling,The melody opens.
S07,Low Dolly Along the Piano,33,7,40,low angle dolly,"slow low-angle dolly along the piano rim, no fast orbit",0:33 - harmonic swell; camera movement becomes more expansive,Light moves across the piano.
S08,Final Cadence and Soft Fade,40,8,48,medium-wide ending shot,slow pull-back with soft fade out,0:40 - final cadence; last chord and lingering resonance,The final chord lingers.
